{
  "$schema": "../../../contracts/audit-report.schema.json",
  "auditVersion": "1.0.0",
  "site": "https://healthy.example.com",
  "generatedAt": "2026-04-10T00:00:00Z",
  "summary": {
    "status": "healthy",
    "sitewideBlockers": 0,
    "diagnosisGroups": 0,
    "repeatedPatternProblems": 0,
    "corePageFailures": 0,
    "lowValueNoiseFindings": 0
  },
  "diagnosisGroups": [],
  "findings": [
    {
      "id": "missing-llms-txt",
      "severity": "low",
      "narrativeSeverity": "optional",
      "type": "optional-signal",
      "scope": "sitewide",
      "title": "llms.txt is absent",
      "evidence": [
        "No llms.txt file was included in the artifact set"
      ]
    }
  ],
  "unknowns": [
    "Prompt coverage data was not provided."
  ],
  "nextActions": [
    "Treat llms.txt as optional follow-up work only if the team wants a stronger machine-readable publishing surface."
  ]
}
